Country,State,Name,Lat,Lon,WMO,ExtrLow
United States,New York,"JAMESTOWN (AWOS), NY, USA",42.15,-79.27,725235,-20.1
United States,New York,"MASSENA AP, NY, USA",44.94,-74.85,726223,-30.4
United States,New York,"NEW YORK J F KENNEDY INT'L AR, NY, USA",40.66,-73.8,744860,-13.7
United States,New York,"NEW YORK LAGUARDIA ARPT, NY, USA",40.78,-73.88,725030,-13.7
United States,New York,"NEWBURGH/STEWART, NY, USA",41.5,-74.1,725038,-20
United States,New York,"NIAGARA FALLS AF, NY, USA",43.11,-78.95,725287,-20.3
United States,New York,"PLATTSBURGH AFB, NY, USA",44.65,-73.47,726225,-28
United States,New York,"POUGHKEEPSIE DUTCHESS CO AP, NY, USA",41.63,-73.88,725036,-22.3
United States,New York,"REPUBLIC, NY, USA",40.72,-73.4,744864,-13
United States,New York,"ROCHESTER GREATER ROCHESTER I, NY, USA",43.12,-77.68,725290,-20
United States,New York,"SUPERIOR SHOALS, NY, USA",44.48,-75.8,994580,-23.1
United States,New York,"SYRACUSE HANCOCK INT'L ARPT, NY, USA",43.11,-76.1,725190,-23.6
United States,New York,"UTICA ONEIDA COUNTY AP, NY, USA",43.15,-75.38,725197,-24.4
United States,New York,"WATERTOWN AP, NY, USA",43.99,-76.02,726227,-32
United States,New York,"WHITE PLAINS WESTCHESTER CO A, NY, USA",41.07,-73.71,725037,-16.7
United States,North Carolina,"ASHEVILLE REGIONAL ARPT, NC, USA",35.43,-82.54,723150,-15.2
United States,North Carolina,"CAPE HATTERAS, NC, USA",35.27,-75.55,723040,-4.1
United States,North Carolina,"CAPE LOOKOUT, NC, USA",34.62,-76.52,994160,-6
United States,North Carolina,"CHARLOTTE DOUGLAS INTL ARPT, NC, USA",35.21,-80.94,723140,-11.1
United States,North Carolina,"CHERRY POINT MCAS, NC, USA",34.9,-76.88,723090,-9.3
United States,North Carolina,"DIAMOND SHOALS (LS), NC, USA",35.15,-75.3,994030,-3
United States,North Carolina,"FAYETTEVILLE RGNL G, NC, USA",34.98,-78.88,723035,-10.2
United States,North Carolina,"FORT BRAGG/SIMMONS, NC, USA",35.13,-78.93,746930,-10.4
United States,North Carolina,"FRYING PAN SHOALS, NC, USA",33.48,-77.58,994040,-1.7
United States,North Carolina,"GREENSBORO PIEDMONT TRIAD INT, NC, USA",36.1,-79.94,723170,-13
United States,North Carolina,"HATTERAS BILLY MITCHELL AP, NC, USA",35.23,-75.62,723139,-5.8
United States,North Carolina,"HICKORY REGIONAL AP, NC, USA",35.74,-81.39,723145,-12.5
United States,North Carolina,"JACKSONVILLE (AWOS), NC, USA",34.83,-77.62,723069,-10.5
United States,North Carolina,"NEW BERN CRAVEN CO REGL AP, NC, USA",35.07,-77.05,723095,-9.4
United States,North Carolina,"NEW RIVER MCAF, NC, USA",34.7,-77.43,723096,-9.3
United States,North Carolina,"PITT GREENVILLE ARP, NC, USA",35.63,-77.4,723065,-9.5
United States,North Carolina,"POPE AFB, NC, USA",35.17,-79.02,723030,-10.4
United States,North Carolina,"RALEIGH DURHAM INTERNATIONAL, NC, USA",35.87,-78.79,723060,-11.9
United States,North Carolina,"RICHMOND INTERNATIONAL AP, NC, USA",37.51,-77.32,724010,-13.2
United States,North Carolina,"SEYMOUR-JOHNSON AFB, NC, USA",35.33,-77.97,723066,-10.1
United States,North Carolina,"SOUTHERN PINES AWOS, NC, USA",35.23,-79.4,723143,-12.5
United States,North Carolina,"WILMINGTON INTERNATIONAL ARPT, NC, USA",34.27,-77.91,723013,-8.7
United States,North Carolina,"WINSTON-SALEM REYNOLDS AP, NC, USA",36.13,-80.22,723193,-12.5
United States,North Dakota,"BISMARCK MUNICIPAL ARPT, ND, USA",46.77,-100.75,727640,-33.1
United States,North Dakota,"DEVILS LAKE (AMOS), ND, USA",48.1,-98.87,727580,-33.3
United States,North Dakota,"DEVILS LAKE(AWOS), ND, USA",48.12,-98.92,727573,-32.8
United States,North Dakota,"DICKINSON MUNICIPAL AP, ND, USA",46.8,-102.8,727645,-31.2
United States,North Dakota,"FARGO HECTOR INTERNATIONAL AP, ND, USA",46.93,-96.81,727530,-31.5
United States,North Dakota,"GRAND FORKS AFB, ND, USA",47.97,-97.4,727575,-31.8
United States,North Dakota,"GRAND FORKS INTERNATIONAL AP, ND, USA",47.95,-97.18,727576,-33
United States,North Dakota,"JAMESTOWN MUNICIPAL ARPT, ND, USA",46.93,-98.68,727535,-30.6
United States,North Dakota,"LIDGERWOOD (RAMOS), ND, USA",46.1,-97.15,727534,-30.8
United States,North Dakota,"MINOT AFB, ND, USA",48.42,-101.35,727675,-32.5
United States,North Dakota,"MINOT FAA AP, ND, USA",48.26,-101.28,727676,-30.6
United States,North Dakota,"WILLISTON SLOULIN INTL AP, ND, USA",48.2,-103.64,727670,-34
United States,Ohio,"AKRON AKRON-CANTON REG AP, OH, USA",40.92,-81.44,725210,-21
United States,Ohio,"CINCINNATI MUNICIPAL AP LUNKI, OH, USA",39.1,-84.42,724297,-18.8
United States,Ohio,"CLEVELAND HOPKINS INTL AP, OH, USA",41.41,-81.85,725240,-20
United States,Ohio,"COLUMBUS PORT COLUMBUS INTL A, OH, USA",39.99,-82.88,724280,-19.6
United States,Ohio,"DAYTON INTERNATIONAL AIRPORT, OH, USA",39.91,-84.22,724290,-21.4
United States,Ohio,"FINDLAY AIRPORT, OH, USA",41.01,-83.67,725366,-21.5
United States,Ohio,"LANCASTER\FAIRFIEL, OH, USA",39.75,-82.65,724294,-21.4
United States,Ohio,"MANSFIELD LAHM MUNICIPAL ARPT, OH, USA",40.82,-82.52,725246,-21.8
United States,Ohio,"OHIO STATE UNIVERSI, OH, USA",40.07,-83.07,724288,-17.9
United States,Ohio,"RICKENBACKER ANGB, OH, USA",39.82,-82.93,724285,-19.2
United States,Ohio,"SOUTH BASS ISLAND, OH, USA",41.62,-82.83,994340,-17
United States,Ohio,"TOLEDO EXPRESS AIRPORT, OH, USA",41.59,-83.8,725360,-21.2
United States,Ohio,"WRIGHT-PATERSON AFB, OH, USA",39.83,-84.05,745700,-20.9
United States,Ohio,"YOUNGSTOWN REGIONAL AIRPORT, OH, USA",41.25,-80.67,725250,-20.6
United States,Ohio,"ZANESVILLE MUNICIPAL AP, OH, USA",39.94,-81.89,724286,-20.7
United States,Oklahoma,"ALTUS AFB, OK, USA",34.67,-99.27,723520,-13
United States,Oklahoma,"CLINTON-SHERMAN, OK, USA",35.33,-99.2,723526,-13.2
United States,Oklahoma,"FORT SILL, OK, USA",34.65,-98.4,723550,-13.2
United States,Oklahoma,"GAGE AIRPORT, OK, USA",36.3,-99.78,723527,-18.5
United States,Oklahoma,"HOBART MUNICIPAL AP, OK, USA",35.01,-99.05,723525,-13.8
United States,Oklahoma,"LAWTON MUNICIPAL, OK, USA",34.57,-98.42,723575,-11.6
United States,Oklahoma,"MCALESTER MUNICIPAL AP, OK, USA",34.9,-95.78,723566,-13.8
United States,Oklahoma,"OKLAHOMA CITY WILL ROGERS WOR, OK, USA",35.39,-97.6,723530,-14.4
United States,Oklahoma,"OKLAHOMA CITY/WILEY, OK, USA",35.53,-97.65,723544,-14.7
United States,Oklahoma,"PONCA CITY MUNICIPAL AP, OK, USA",36.73,-97.1,723546,-15.7
United States,Oklahoma,"STILLWATER RGNL, OK, USA",36.15,-97.08,723545,-14.8
United States,Oklahoma,"TINKER AFB, OK, USA",35.42,-97.38,723540,-13.8
United States,Oklahoma,"TULSA INTERNATIONAL AIRPORT, OK, USA",36.2,-95.89,723560,-15
United States,Oklahoma,"TULSA/LLOYD JONES, OK, USA",36.03,-95.98,723564,-14.4
United States,Oklahoma,"VANCE AFB, OK, USA",36.33,-97.92,723535,-16.4
United States,Oregon,"ASTORIA REGIONAL AIRPORT, OR, USA",46.16,-123.88,727910,-5.4
United States,Oregon,"AURORA STATE, OR, USA",45.25,-122.77,726959,-5.4
United States,Oregon,"BAKER MUNICIPAL AP, OR, USA",44.84,-117.81,726886,-23.1
United States,Oregon,"BURNS MUNICIPAL ARPT, OR, USA",43.59,-118.95,726830,-22.8
United States,Oregon,"CAPE ARAGO (LS), OR, USA",43.33,-124.37,994240,-0.3
United States,Oregon,"CORVALLIS MUNI, OR, USA",44.48,-123.28,726945,-7.8
United States,Oregon,"EUGENE MAHLON SWEET ARPT, OR, USA",44.13,-123.21,726930,-8
United States,Oregon,"KLAMATH FALLS INTL AP, OR, USA",42.15,-121.72,725895,-17.7
United States,Oregon,"LA GRANDE MUNI AP, OR, USA",45.29,-118.01,726884,-16.9
United States,Oregon,"LAKEVIEW (AWOS), OR, USA",42.17,-120.4,725976,-20.6
United States,Oregon,"MC MINNVILLE MUNI, OR, USA",45.18,-123.13,726881,-5.3
United States,Oregon,"MEACHAM, OR, USA",45.51,-118.43,726885,-27.7
United States,Oregon,"MEDFORD ROGUE VALLEY INTL AP, OR, USA",42.39,-122.87,725970,-7.7
United States,Oregon,"NEWPORT STATE BEACH, OR, USA",44.62,-124.07,994280,-2
United States,Oregon,"NORTH BEND MUNI AIRPORT, OR, USA",43.42,-124.25,726917,-3.5
United States,Oregon,"PENDLETON E OR REGIONAL AP, OR, USA",45.7,-118.83,726880,-16.1
United States,Oregon,"PORTLAND INTERNATIONAL AP, OR, USA",45.59,-122.6,726980,-6.4
United States,Oregon,"PORTLAND/HILLSBORO, OR, USA",45.53,-122.95,726986,-8.4
United States,Oregon,"REDMOND ROBERTS FIELD, OR, USA",44.25,-121.15,726835,-19.2
United States,Oregon,"SALEM MCNARY FIELD, OR, USA",44.91,-123,726940,-8.4
United States,Oregon,"SEXTON SUMMIT, OR, USA",42.62,-123.38,725975,-7.8
United States,Pennsylvania,"ALLENTOWN LEHIGH VALLEY INTL, PA, USA",40.65,-75.45,725170,-17.4
United States,Pennsylvania,"ALTOONA BLAIR CO ARPT, PA, USA",40.3,-78.32,725126,-19.2
United States,Pennsylvania,"BRADFORD REGIONAL AP, PA, USA",41.8,-78.64,725266,-24.7
United States,Pennsylvania,"BUTLER CO. (AWOS), PA, USA",40.78,-79.95,725124,-19.1
United States,Pennsylvania,"DUBOIS FAA AP, PA, USA",41.18,-78.9,725125,-22.1
United States,Pennsylvania,"ERIE INTERNATIONAL AP, PA, USA",42.08,-80.18,725260,-18
United States,Pennsylvania,"FRANKLIN, PA, USA",41.44,-79.85,725267,-20.1
United States,Pennsylvania,"HARRISBURG CAPITAL CITY ARPT, PA, USA",40.22,-76.85,725118,-16.9
United States,Pennsylvania,"JOHNSTOWN CAMBRIA COUNTY AP, PA, USA",40.3,-78.83,725127,-19.9
United States,Pennsylvania,"MIDDLETOWN HARRISBURG INTL AP, PA, USA",40.19,-76.76,725115,-15.4
United States,Pennsylvania,"PHILADELPHIA INTERNATIONAL AP, PA, USA",39.87,-75.23,724080,-14.1
United States,Pennsylvania,"PHILADELPHIA NE PHILADELPHIA, PA, USA",40.08,-75.01,724085,-15.3
United States,Pennsylvania,"PITTSBURGH ALLEGHENY CO AP, PA, USA",40.36,-79.92,725205,-19.5
United States,Pennsylvania,"PITTSBURGH INTERNATIONAL AP, PA, USA",40.5,-80.23,725200,-19.5
United States,Pennsylvania,"WILKES-BARRE SCRANTON INTL AP, PA, USA",41.34,-75.73,725130,-19.3
United States,Pennsylvania,"WILLIAMSPORT REGIONAL AP, PA, USA",41.24,-76.92,725140,-19.1
United States,Pennsylvania,"WILLOW GROVE NAS, PA, USA",40.2,-75.15,724086,-16.7
United States,Rhode Island,"BLOCK ISLAND STATE ARPT, RI, USA",41.17,-71.58,725058,-14.2
United States,Rhode Island,"PROVIDENCE T F GREEN STATE AR, RI, USA",41.72,-71.43,725070,-17
United States,South Carolina,"ANDERSON COUNTY AP, SC, USA",34.5,-82.71,723125,-9.9
United States,South Carolina,"BEAUFORT MCAS, SC, USA",32.48,-80.72,722085,-6.4
United States,South Carolina,"CHARLESTON INTL ARPT, SC, USA",32.9,-80.04,722080,-7
United States,South Carolina,"COLUMBIA METRO ARPT, SC, USA",33.94,-81.12,723100,-9.5
United States,South Carolina,"FLORENCE REGIONAL AP, SC, USA",34.19,-79.73,723106,-9.3
United States,South Carolina,"FOLLY ISLAND, SC, USA",32.68,-79.88,994230,-3.4
United States,South Carolina,"GREER GREENV'L-SPARTANBRG AP, SC, USA",34.9,-82.22,723120,-11.1
United States,South Carolina,"MYRTLE BEACH AFB, SC, USA",33.68,-78.92,747910,-8.3
United States,South Carolina,"SHAW AFB/SUMTER, SC, USA",33.97,-80.47,747900,-8.9
United States,South Dakota,"ABERDEEN REGIONAL ARPT, SD, USA",45.45,-98.42,726590,-32.3
United States,South Dakota,"BROOKINGS (AWOS), SD, USA",44.3,-96.82,726515,-29.5
United States,South Dakota,"BUFFALO (AMOS), SD, USA",45.6,-103.55,726627,-28.8
United States,South Dakota,"CHAMBERLAIN (AMOS), SD, USA",43.8,-99.32,726530,-26.9
United States,South Dakota,"CHAN GURNEY MUNI, SD, USA",42.92,-97.38,726525,-25.3
United States,South Dakota,"CUSTER (RAMOS), SD, USA",43.73,-103.62,726514,-28.1
United States,South Dakota,"ELLSWORTH AFB, SD, USA",44.15,-103.1,726625,-25.9
United States,South Dakota,"HURON REGIONAL ARPT, SD, USA",44.39,-98.23,726540,-30.4
United States,South Dakota,"MITCHELL (AWOS), SD, USA",43.77,-98.03,726545,-26.9
United States,South Dakota,"MOBRIDGE, SD, USA",45.53,-100.43,726685,-29.7
United States,South Dakota,"PIERRE MUNICIPAL AP, SD, USA",44.38,-100.29,726686,-27.8
United States,South Dakota,"RAPID CITY REGIONAL ARPT, SD, USA",44.05,-103.05,726620,-27.4
United States,South Dakota,"SIOUX FALLS FOSS FIELD, SD, USA",43.58,-96.75,726510,-28.6
United States,South Dakota,"WATERTOWN MUNICIPAL AP, SD, USA",44.93,-97.15,726546,-29.3
United States,Tennessee,"BRISTOL TRI CITY AIRPORT, TN, USA",36.48,-82.4,723183,-16.5
United States,Tennessee,"CHATTANOOGA LOVELL FIELD AP, TN, USA",35.03,-85.2,723240,-12.2
United States,Tennessee,"CROSSVILLE MEMORIAL AP, TN, USA",35.95,-85.09,723265,-17.9
United States,Tennessee,"DYERSBURG MUNICIPAL AP, TN, USA",36.02,-89.32,723347,-11.9
United States,Tennessee,"JACKSON MCKELLAR-SIPES REGL A, TN, USA",35.59,-88.92,723346,-14.6
United States,Tennessee,"KNOXVILLE MCGHEE TYSON AP, TN, USA",35.82,-83.99,723260,-14.5
United States,Tennessee,"MEMPHIS INTERNATIONAL AP, TN, USA",35.06,-89.99,723340,-11.8
United States,Tennessee,"MILLINGTON MUNI ARP, TN, USA",35.35,-89.87,723284,-13.6
United States,Tennessee,"NASHVILLE INTERNATIONAL AP, TN, USA",36.12,-86.69,723270,-15.2
United States,Territory or Island,"ANDERSEN AFB, Guam",13.57,144.92,912180,21.8
United States,Territory or Island,"GUAM WFO, Guam",13.48,144.8,912120,21.4
United States,Territory or Island,"MIDWAY ISLAND NAS, United States Minor Outlying Islands",28.2,-177.38,910660,13
United States,Territory or Island,"PAGO PAGO WSO AP, American Samoa",-14.33,-170.71,917650,21.1
United States,Territory or Island,"WAKE ISLAND, United States Minor Outlying Islands",19.28,166.64,912450,20.4
United States,Texas,"ABILENE DYESS AFB, TX, USA",32.43,-99.85,690190,-12.2
United States,Texas,"ABILENE REGIONAL AP, TX, USA",32.41,-99.68,722660,-10.9
United States,Texas,"ALICE INTL AP, TX, USA",27.74,-98.03,722517,-2
United States,Texas,"AMARILLO INTERNATIONAL AP, TX, USA",35.22,-101.71,723630,-17.3
United States,Texas,"AUSTIN/BERGSTROM, TX, USA",30.18,-97.68,722540,-7.1
United States,Texas,"BEEVILLE CHASE NAAS, TX, USA",28.37,-97.67,722556,-5
United States,Texas,"BROWNSVILLE S PADRE ISL INTL, TX, USA",25.91,-97.43,722500,0.2
United States,Texas,"BURNET MUNI., TX, USA",30.73,-98.23,722542,-5.5
United States,Texas,"CAMP MABRY, TX, USA",30.32,-97.77,722544,-5.4
United States,Texas,"CHILDRESS MUNICIPAL AP, TX, USA",34.43,-100.29,723604,-12.2
United States,Texas,"COLLEGE STATION EASTERWOOD FL, TX, USA",30.59,-96.36,722445,-6.4
United States,Texas,"CORPUS CHRISTI INTL ARPT, TX, USA",27.77,-97.51,722510,-2.8
United States,Texas,"CORPUS CHRISTI NAS, TX, USA",27.7,-97.28,722515,-0.9
United States,Texas,"COTULLA FAA AP, TX, USA",28.46,-99.22,722526,-4.1
United States,Texas,"COX FLD, TX, USA",33.63,-95.45,722587,-9.9
United States,Texas,"DALHART MUNICIPAL AP, TX, USA",36.02,-102.55,722636,-17.3
United States,Texas,"DALLAS HENSLEY FIELD NAS, TX, USA",32.73,-96.97,722585,-9.2
United States,Texas,"DALLAS LOVE FIELD, TX, USA",32.85,-96.85,722583,-8.2
United States,Texas,"DALLAS/REDBIRD ARPT, TX, USA",32.68,-96.87,722599,-7.6
United States,Texas,"DALLAS-FORT WORTH INTL AP, TX, USA",32.9,-97.04,722590,-9.1
United States,Texas,"DEL RIO INTERNATIONAL AP, TX, USA",29.37,-100.92,722610,-3.5
United States,Texas,"DRAUGHON MILLER CEN, TX, USA",31.15,-97.4,722577,-6.8
United States,Texas,"EL PASO INTERNATIONAL AP, TX, USA",31.81,-106.38,722700,-8.9
United States,Texas,"FORT HOOD/GRAY AAF, TX, USA",31.07,-97.83,722576,-7.5
United States,Texas,"FORT STOCKTON PECOS, TX, USA",30.92,-102.92,722618,-7.6
United States,Texas,"FORT WORTH ALLIANCE, TX, USA",32.98,-97.32,722594,-8.6
United States,Texas,"FORT WORTH MEACHAM, TX, USA",32.82,-97.36,722596,-9.5
United States,Texas,"FORT WORTH NAS, TX, USA",32.77,-97.44,722595,-9.8
United States,Texas,"GALVESTON/SCHOLES, TX, USA",29.27,-94.86,722420,-1.6
United States,Texas,"GEORGETOWN (AWOS), TX, USA",30.68,-97.68,722547,-6.6
United States,Texas,"HARLINGEN RIO GRANDE VALLEY I, TX, USA",26.23,-97.65,722505,-0.1
United States,Texas,"HONDO MUNICIPAL AP, TX, USA",29.36,-99.17,722533,-6.9
United States,Texas,"HOUSTON BUSH INTERCONTINENTAL, TX, USA",29.99,-95.36,722430,-4.4
United States,Texas,"HOUSTON WILLIAM P HOBBY AP, TX, USA",29.65,-95.28,722435,-3.1
United States,Texas,"HOUSTON/D.W. HOOKS, TX, USA",30.07,-95.55,722429,-4.1
United States,Texas,"HOUSTON/ELLINGTON, TX, USA",29.6,-95.17,722436,-2.6
United States,Texas,"JUNCTION KIMBLE COUNTY AP, TX, USA",30.51,-99.77,747400,-9.9
United States,Texas,"KELLY AFB, TX, USA",29.38,-98.58,722535,-6.4
United States,Texas,"KILLEEN MUNI (AWOS), TX, USA",31.08,-97.68,722575,-6.3
United States,Texas,"KINGSVILLE, TX, USA",27.5,-97.82,722516,-2.6
United States,Texas,"LAREDO INTL AIRPORT, TX, USA",27.55,-99.47,722520,-1.6
United States,Texas,"LAUGHLIN AFB, TX, USA",29.37,-100.78,722615,-5.1
United States,Texas,"LONGVIEW GREGG COUNTY AP, TX, USA",32.39,-94.71,722470,-8.2
United States,Texas,"LUBBOCK INTERNATIONAL AP, TX, USA",33.67,-101.82,722670,-13.5
United States,Texas,"LUFKIN ANGELINA CO, TX, USA",31.23,-94.75,722446,-7.1
United States,Texas,"MARFA AP, TX, USA",30.37,-104.02,722640,-13.7
United States,Texas,"MC GREGOR (AWOS), TX, USA",31.48,-97.32,722563,-6.7
United States,Texas,"MCALLEN MILLER INTL AP, TX, USA",26.18,-98.24,722506,-0.4
United States,Texas,"MCKINNEY MUNI ARPT, TX, USA",33.18,-96.58,722541,-9.5
United States,Texas,"MIDLAND INTERNATIONAL AP, TX, USA",31.93,-102.21,722650,-11.4
United States,Texas,"NACOGDOCHES (AWOS), TX, USA",31.58,-94.72,722499,-7.4
United States,Texas,"PALACIOS MUNICIPAL AP, TX, USA",28.73,-96.25,722555,-2.7
United States,Texas,"PINE SPRINGS GUADALUPE MOUNTA, TX, USA",31.83,-104.81,722620,-11.9
United States,Texas,"PORT ARANSAS, TX, USA",27.82,-97.05,994110,-0.1
United States,Texas,"PORT ARTHUR JEFFERSON COUNTY, TX, USA",29.95,-94.02,722410,-3.9
United States,Texas,"RANDOLPH AFB, TX, USA",29.53,-98.28,722536,-5.8
United States,Texas,"REESE AFB, TX, USA",33.6,-102.05,722675,-13.9
United States,Texas,"ROCKPORT/ARANSAS CO, TX, USA",28.08,-97.05,722524,-0.2
United States,Texas,"SABINE, TX, USA",29.67,-94.05,994260,-2.9
United States,Texas,"SAN ANGELO MATHIS FIELD, TX, USA",31.35,-100.49,722630,-10.2
United States,Texas,"SAN ANTONIO INTL AP, TX, USA",29.53,-98.46,722530,-5.8
United States,Texas,"SAN ANTONIO/STINSON, TX, USA",29.34,-98.47,722523,-3.8
United States,Texas,"SAN MARCOS MUNI, TX, USA",29.88,-97.87,722539,-5.1
United States,Texas,"SANDERSON (RAMOS), TX, USA",30.17,-102.42,747300,-8.2
United States,Texas,"STEPHENVILLE CLARK FIELD, TX, USA",32.22,-98.18,722600,-10.2
United States,Texas,"VICTORIA REGIONAL AP, TX, USA",28.86,-96.93,722550,-4.2
United States,Texas,"WACO REGIONAL AP, TX, USA",31.61,-97.23,722560,-8
United States,Texas,"WICHITA FALLS MUNICIPAL ARPT, TX, USA",33.98,-98.49,723510,-12.2
United States,Texas,"WINK WINKLER COUNTY AP, TX, USA",31.78,-103.2,722656,-11
United States,Utah,"CEDAR CITY MUNICIPAL AP, UT, USA",37.7,-113.1,724755,-20.9
United States,Utah,"HILL AFB/OGDEN, UT, USA",41.12,-111.97,725755,-16.1
United States,Utah,"LOGAN-CACHE AIRPORT, UT, USA",41.79,-111.85,724796,-23.6
United States,Utah,"MILFORD MUNICIPAL AP, UT, USA",38.44,-113.03,724797,-22.1
United States,Utah,"PRICE/CARBON COUNTY, UT, USA",39.62,-110.75,724700,-18.7
United States,Utah,"PROVO MUNI (AWOS), UT, USA",40.22,-111.72,725724,-15
United States,Utah,"SAINT GEORGE (AWOS), UT, USA",37.08,-113.6,724754,-5.8
United States,Utah,"SALT LAKE CITY INT'L ARPT, UT, USA",40.79,-111.97,725720,-16.3
United States,Utah,"VERNAL, UT, USA",40.43,-109.52,725705,-20.2
United States,Utah,"WENDOVER USAF AUXILIARY FIELD, UT, USA",40.72,-114.02,725810,-16.1
United States,Vermont,"BURLINGTON INTERNATIONAL AP, VT, USA",44.47,-73.15,726170,-26.1
United States,Vermont,"MONTPELIER AP, VT, USA",44.2,-72.58,726145,-27.9
United States,Vermont,"MORRISVILLE\STONE, VT, USA",44.53,-72.62,726114,-28.3
United States,Vermont,"RUTLAND STATE, VT, USA",43.52,-72.95,725165,-25.8
United States,Vermont,"SPRINGFIELD/HARTNES, VT, USA",43.35,-72.52,726115,-24.5
United States,Virginia ,"ABINGTON, VA, USA",36.68,-82.03,724058,-15.8
United States,Virginia ,"CHESAPEAKE, VA, USA",36.9,-75.72,994020,-7.7
United States,Virginia ,"DANVILLE FAA AP, VA, USA",36.57,-79.34,724106,-11.8
United States,Virginia ,"DINWIDDIE CO, VA, USA",37.18,-77.5,724014,-14.3
United States,Virginia ,"FARMVILLE, VA, USA",37.35,-78.43,724017,-16
United States,Virginia ,"FORT BELVOIR/DAVISO, VA, USA",38.72,-77.18,724037,-16.5
United States,Virginia ,"HILLSVILLE, VA, USA",36.77,-80.82,724107,-14.5
United States,Virginia ,"HOT SPRINGS/INGALLS, VA, USA",37.95,-79.83,724115,-19.3
United States,Virginia ,"LANGLEY AFB/HAMPTON, VA, USA",37.08,-76.37,745980,-10.2
United States,Virginia ,"LEESBURG/GODFREY, VA, USA",39.08,-77.57,724055,-14.4
United States,Virginia ,"LYNCHBURG REGIONAL ARPT, VA, USA",37.34,-79.21,724100,-15.1
United States,Virginia ,"MANASSAS MUNI(AWOS), VA, USA",38.72,-77.52,724036,-16.4
United States,Virginia ,"MARION / WYTHEVILLE, VA, USA",36.9,-81.35,724056,-17.1
United States,Virginia ,"MARTINSVILLE, VA, USA",36.63,-80.02,745985,-14.8
United States,Virginia ,"NEWPORT NEWS, VA, USA",37.13,-76.49,723086,-11.4
United States,Virginia ,"NORFOLK INTERNATIONAL AP, VA, USA",36.9,-76.19,723080,-9.1
United States,Virginia ,"NORFOLK NAS, VA, USA",36.93,-76.28,723085,-8.5
United States,Virginia ,"OCEANA NAS, VA, USA",36.82,-76.03,723075,-9.5
United States,Virginia ,"QUANTICO MCAS, VA, USA",38.5,-77.3,724035,-13.1
United States,Virginia ,"ROANOKE REGIONAL AP, VA, USA",37.32,-79.97,724110,-14.3
United States,Virginia ,"SHANNON ARPT, VA, USA",38.27,-77.45,724033,-14.8
United States,Virginia ,"STAUNTON/SHENANDOAH, VA, USA",38.27,-78.9,724105,-16.5
United States,Virginia ,"VIRGINIA TECH ARPT, VA, USA",37.22,-80.42,724113,-15.3
United States,Virginia ,"WALLOPS ISLAND UAU, VA, USA",37.94,-75.5,724020,-11
United States,Virginia ,"WASHINGTON DC DULLES INT'L AR, VA, USA",38.94,-77.45,724030,-17.2
United States,Virginia ,"WASHINGTON DC REAGAN AP, VA, USA",38.87,-77.03,724050,-12.3
United States,Virginia ,"WINCHESTER RGNL, VA, USA",39.15,-78.15,724053,-14.5
United States,Washington,"ARLINGTON MUNI, WA, USA",48.17,-122.17,727945,-8.8
United States,Washington,"BELLINGHAM INTL AP, WA, USA",48.79,-122.54,727976,-10.1
United States,Washington,"BREMERTON NATIONAL, WA, USA",47.48,-122.75,727928,-7.5
United States,Washington,"DESTRUCTION ISLAND, WA, USA",47.67,-124.48,994070,-1.5
United States,Washington,"FAIRCHILD AFB, WA, USA",47.62,-117.65,727855,-18.7
United States,Washington,"FELTS FLD, WA, USA",47.68,-117.32,727856,-17
United States,Washington,"FRIDAY HARBOR, WA, USA",48.52,-123.02,727985,-5.4
United States,Washington,"GRAY AAF, WA, USA",47.08,-122.58,742071,-10
United States,Washington,"HANFORD, WA, USA",46.57,-119.6,727840,-16
United States,Washington,"HOQUIAM AP, WA, USA",46.97,-123.94,727923,-4.3
United States,Washington,"KELSO WB AP, WA, USA",46.12,-122.89,727924,-7.7
United States,Washington,"MC CHORD AFB/TACOMA, WA, USA",47.13,-122.48,742060,-10.3
United States,Washington,"OLYMPIA AIRPORT, WA, USA",46.97,-122.9,727920,-10.8
United States,Washington,"OMAK, WA, USA",48.42,-119.53,727890,-16
United States,Washington,"PASCO, WA, USA",46.27,-119.12,727845,-16.9
United States,Washington,"PEARSON FLD, WA, USA",45.62,-122.65,727918,-7
United States,Washington,"PULLMAN/MOSCOW RGNL, WA, USA",46.75,-117.12,727857,-18.1
United States,Washington,"QUILLAYUTE STATE AIRPORT, WA, USA",47.93,-124.56,727970,-7.4
United States,Washington,"SEATTLE BOEING FIELD, WA, USA",47.53,-122.3,727935,-7.3
United States,Washington,"SEATTLE SEATTLE-TACOMA INTL A, WA, USA",47.46,-122.31,727930,-6.3
United States,Washington,"SHELTON/SANDERSON, WA, USA",47.24,-123.15,727925,-7.1
United States,Washington,"SMITH ISLAND, WA, USA",48.32,-122.83,994180,-2.9
United States,Washington,"SNOHOMISH CO, WA, USA",47.9,-122.28,727937,-4.9
United States,Washington,"SPOKANE INTERNATIONAL AP, WA, USA",47.62,-117.53,727850,-20.1
United States,Washington,"STAMPEDE PASS, WA, USA",47.29,-121.34,727815,-15.1
United States,Washington,"TACOMA NARROWS, WA, USA",47.27,-122.57,727938,-3.5
United States,Washington,"TATOOSH ISLAND, WA, USA",48.38,-124.73,994300,-1.6
United States,Washington,"WALLA WALLA CITY COUNTY AP, WA, USA",46.1,-118.29,727846,-14.3
United States,Washington,"WENATCHEE/PANGBORN, WA, USA",47.4,-120.21,727825,-16.2
United States,Washington,"WEST POINT (LS), WA, USA",47.67,-122.43,994350,-2.8
United States,Washington,"WHIDBEY ISLAND NAS, WA, USA",48.35,-122.65,690230,-8.5
United States,Washington,"WILLIAM R FAIRCHILD, WA, USA",48.12,-123.5,727885,-5.9
United States,Washington,"YAKIMA AIR TERMINAL, WA, USA",46.56,-120.53,727810,-18
United States,West Virginia,"BECKLEY RALEIGH CO MEM AP, WV, USA",37.8,-81.13,724120,-19.7
United States,West Virginia,"BLUEFIELD/MERCER CO, WV, USA",37.3,-81.21,724125,-19.4
United States,West Virginia,"CHARLESTON YEAGER ARPT, WV, USA",38.38,-81.59,724140,-18
United States,West Virginia,"ELKINS ELKINS-RANDOLPH CO ARP, WV, USA",38.89,-79.85,724170,-24.2
United States,West Virginia,"HARRISON MARION RGN, WV, USA",39.28,-80.22,724175,-17.2
United States,West Virginia,"HUNTINGTON TRI-STATE ARPT, WV, USA",38.38,-82.56,724250,-18
United States,West Virginia,"MARTINSBURG EASTERN WV REG AP, WV, USA",39.4,-77.98,724177,-17.9
United States,West Virginia,"MORGANTOWN HART FIELD, WV, USA",39.64,-79.92,724176,-18.5
United States,West Virginia,"PARKERSBURG WOOD COUNTY AP, WV, USA",39.35,-81.44,724273,-19.3
United States,Wisconsin,"APPLETON/OUTAGAMIE, WI, USA",44.25,-88.52,726457,-23.9
United States,Wisconsin,"DEVILS ISLAND, WI, USA",47.08,-90.73,994190,-23.7
United States,Wisconsin,"EAGLE RIVER UNION, WI, USA",45.93,-89.27,726504,-31.4
United States,Wisconsin,"EAU CLAIRE COUNTY AP, WI, USA",44.87,-91.49,726435,-29.5
United States,Wisconsin,"FOND DU LAC CO., WI, USA",43.77,-88.49,726506,-23.9
United States,Wisconsin,"GREEN BAY AUSTIN STRAUBEL INT, WI, USA",44.51,-88.12,726450,-27
United States,Wisconsin,"HAYWARD MUNI ARPT, WI, USA",46.03,-91.45,726508,-32.1
United States,Wisconsin,"JUNEAU\DODGE CO, WI, USA",43.43,-88.7,726509,-23
United States,Wisconsin,"KENOSHA RGNL, WI, USA",42.58,-87.92,726505,-23
